{
  "run_id": "20260203-182331Z-vibeagents",
  "phase": "phase2_scaffold",
  "gate_status": "approved",
  "started_at": "2026-02-03T18:23:31Z",
  "updated_at": "2026-02-03T18:23:31Z",
  "checkpoints": [
    "tree_and_manifest_generated",
    "core_docs_generated",
    "context_layers_generated",
    "agent_system_generated",
    "tool_rules_generated",
    "scripts_generated"
  ]
}
